{
  "schema_version": 1,
  "chapter_id": "01JZCHAPTER0000000000001",
  "book_id": "01JZBOOK000000000000000001",
  "chapter_index": 1,
  "title": "乌坦城风起",
  "segmentation_status": "segmented",
  "text_object_ref": "object://source-chapters/01JZCHAPTER0000000000001",
  "text_range": "c1:p1-p3",
  "raw_text": "第一章 乌坦城风起\n萧炎沉默地站在大厅中央。",
  "text_excerpt": "萧炎沉默地站在大厅中央。",
  "created_at": "2026-07-12T02:00:00Z",
  "updated_at": "2026-07-12T02:00:00Z"
}
